cleaned_wrong_sentence,cleaned_true_sentence
ليست قلبي مهمترين عامل علت مرگ مير تهراني,ايست قلبي مهمترين عامل علت مرگ مير تهراني
انطباق قابل قبولي نيازهاي حرفهاي مرتبط ساختمان يازي ندارند,انطباق قابل قبولي نيازهاي حرفهاي مرتبط ساختمان سازي ندارند
چهار نمونه مصالح ساختمان يازي نام بريد,چهار نمونه مصالح ساختمان سازي نام بريد
سرپرستي اداره امور اجزاي انجمن عكاسان عنوان شرايط استفاده همكاري اعضاي انجمن,سرپرستي اداره امور اجراي انجمن عكاسان عنوان شرايط استفاده همكاري اعضاي انجمن
امور اجزاي ضروري احياي تفكر اسلام,امور اجراي ضروري احياي تفكر اسلام
همگام ظهر حضرت چهار قبا ماند,هنگام ظهر حضرت چهار قبا ماند
طبيعي قصر ساعت محاصره همگام ظهر سقوط نخواهد كرد,طبيعي قصر ساعت محاصره هنگام ظهر سقوط نخواهد كرد
همگام ظهر غذاي نذري عزاداران پذيراي,هنگام ظهر غذاي نذري عزاداران پذيراي
مختص مفيد بگم شركتو رنگ كرديم,مختصر مفيد بگم شركتو رنگ كرديم
مختص مفيد بگم روبي كردم,مختصر مفيد بگم روبي كردم
مختص مفيد ايراني باشه,مختصر مفيد ايراني باشه
كوتاه مختص مفيد ميگويد جاست,كوتاه مختصر مفيد ميگويد جاست
رام كردن اسب اولين ايران انفاق افتاد,رام كردن اسب اولين ايران اتفاق افتاد
ضربت خوردن شهادت حضرت انفاق افتاد,ضربت خوردن شهادت حضرت اتفاق افتاد
نزول كوتاه مدت طلا ميانه گذشته انفاق افتاد,نزول كوتاه مدت طلا ميانه گذشته اتفاق افتاد
ايران انفاق افتاد انقلاب خواست خدا,ايران اتفاق افتاد انقلاب خواست خدا
جنگ بدر ماهي انفاق افتاد,جنگ بدر ماهي اتفاق افتاد
تجاوز دشمن بعثي ميهن زماني انفاق افتاد,تجاوز دشمن بعثي ميهن زماني اتفاق افتاد
خرابه آباد نشدني ميماندم انفاق افتاد,خرابه آباد نشدني ميماندم اتفاق افتاد
حذف معاونت اداره همكاريهاي سمعي بصري نمايش خانگي انفاق افتاد,حذف معاونت اداره همكاريهاي سمعي بصري نمايش خانگي اتفاق افتاد
يه پيكان وانت انفاق افتاد,يه پيكان وانت اتفاق افتاد
تمرين شب گذشته انفاق افتاد,تمرين شب گذشته اتفاق افتاد
اينبار آژانس انفاق افتاد,اينبار آژانس اتفاق افتاد
ظهر خواب بد ديدم شبشم انفاق افتاد,ظهر خواب بد ديدم شبشم اتفاق افتاد
مقاله برسي ويژگي مثبت پرداختيم,مقاله برسي ويژگي مثبت منفي پرداختيم
احتمال رسيدن سهم بازه مقطعي نوساني مثبت سمت نزول,احتمال رسيدن سهم بازه مقطعي نوساني مثبت منفي سمت نزول
قسمت مثبت خازن ارتباط بياد,قسمت مثبت منفي خازن ارتباط بياد
شيخ طادي كارگران فيلم سينماي روزهاي زندگي تقديم,شيخ طادي كارگردان فيلم سينماي روزهاي زندگي تقديم
كارگران سينما تلويزيون اظهار داشت,كارگردان سينما تلويزيون اظهار داشت
عباس رنجبر كارگران سينما تلويزيون قصد,عباس رنجبر كارگردان سينما تلويزيون قصد
قطعنامه ضد سوري تصويب راي موفق راي مخالف,قطعنامه ضد سوري تصويب راي موافق راي مخالف
كشتي باد موفق مخالف معناي,كشتي باد موافق مخالف معناي
صورت تساوي آراي موفق مخالف ملاك راي ريس شورا,صورت تساوي آراي موافق مخالف ملاك راي ريس شورا
نفر نظر مختلف موفق مخالف دادند,نفر نظر مختلف موافق مخالف دادند
گروه موفق مخالف بن بست عقيدتي رسيدند,گروه موافق مخالف بن بست عقيدتي رسيدند
نتايج سمت موفق مخالف تقسميم ميشوند,نتايج سمت موافق مخالف تقسميم ميشوند
حقيقتآ بگم موفق مخالف بهترين داشته باشم,حقيقتآ بگم موافق مخالف بهترين داشته باشم
محيط خانه خالي تشنج درگيري كشمش باشد بچها بتواند راحتي درس بخواند,محيط خانه خالي تشنج درگيري كشمكش باشد بچها بتواند راحتي درس بخواند
اينحال ادّعا نداريم اصل روابط درگيري كشمش,اينحال ادّعا نداريم اصل روابط درگيري كشمكش
وحدت ملي تفرقه نفاق درگيري كشمش خروج چارچوب مباني اسلام,وحدت ملي تفرقه نفاق درگيري كشمكش خروج چارچوب مباني اسلام
مدارك توضيحات كامل سوي آسارتا درگيري كشمش,مدارك توضيحات كامل سوي آسارتا درگيري كشمكش
قلمروهاي مشترك دچار درگيري كشمش شويم,قلمروهاي مشترك دچار درگيري كشمكش شويم
صورت مشاهده مواردي ميل فا محق پيگرد قانوني جبران ضر وارده ميداند,صورت مشاهده مواردي ميل فا محق پيگرد قانوني جبران ضر زيان وارده ميداند
كارشناسي ضر مشخص,كارشناسي ضر زيان مشخص
دليل كشاورزان منطقه متحمل ضر بيشتري شوند,دليل كشاورزان منطقه متحمل ضر زيان بيشتري شوند
گزارش ضر ميليارد يكصد يازده ميليون دلاري ماهاي مارس اكتبر منتشر,گزارش ضر زيان ميليارد يكصد يازده ميليون دلاري ماهاي مارس اكتبر منتشر
ستفاده ابزارهائي هست سود انجام دادن,ستفاده ابزارهائي هست سود زيان انجام دادن
سود مقطعي عمل نگرد,سود زيان مقطعي عمل نگرد
توانيد سود تاريخهاي مختلف محاسبه كنيد,توانيد سود زيان تاريخهاي مختلف محاسبه كنيد
توكل بنده بفهمد سود دست نيست,توكل بنده بفهمد سود زيان دست نيست
رابطه عضوي علت استعفا ترك عضويت اخراج فوت سود مربوط سالي عضو مزبور سال رابطه عضويت دست داده مجمع عمومي ظرف تاريخ قطع رابطه عضويت پرداخت,رابطه عضوي علت استعفا ترك عضويت اخراج فوت سود زيان مربوط سالي عضو مزبور سال رابطه عضويت دست داده مجمع عمومي ظرف تاريخ قطع رابطه عضويت پرداخت
شخص رباخوار توجهي سود شخص بدهكار,شخص رباخوار توجهي سود زيان شخص بدهكار
حرف سود كاربرها,حرف سود زيان كاربرها
ميتونيد مباحث مربوط ترازنامه صورت سود بخش فصل مرور جامع مطالعه كنيد,ميتونيد مباحث مربوط ترازنامه صورت سود زيان بخش فصل مرور جامع مطالعه كنيد
مشكلات خصوص مسائل ترافيك سد معبد خيابان لالهزار,مشكلات خصوص مسائل ترافيك سد معبر خيابان لالهزار
محوطه مغازه باعث سد معبد شوند,محوطه مغازه باعث سد معبر شوند
رفتار مسولين رفع سد معبد دست فروشان مغازه داراني پياده روها اشغال كد خدامنشي مصالحه,رفتار مسولين رفع سد معبر دست فروشان مغازه داراني پياده روها اشغال كد خدامنشي مصالحه
اصول فروغ دين شامل بخش,اصول فروع دين شامل بخش
طوركه دانيم دين دريك تقسيم بندي اصول فروغ دين تقسيم,طوركه دانيم دين دريك تقسيم بندي اصول فروع دين تقسيم
نسبت اصول فروغ دين ساختار وجودي بشر,نسبت اصول فروع دين ساختار وجودي بشر
طوركه دانيم دين دريك تقسيم بندي اصول فروغ دين تقسيم,طوركه دانيم دين دريك تقسيم بندي اصول فروع دين تقسيم
حافظ پاسدار اصول فروغ دين باشند,حافظ پاسدار اصول فروع دين باشند
عامل رشد بالندگي اصول فروغ دين اسلام امامت,عامل رشد بالندگي اصول فروع دين اسلام امامت
اصول فروغ دين لوح حقوق بشر كوروش بزرگ,اصول فروع دين لوح حقوق بشر كوروش بزرگ
جامعه اسلامى اولين مسائلى خانواده مدرسه كودكان آموزش داده مىشود اصول فروغ دين شمار فروغ دين فرع هفتم هشتم امر معروف نهى منكر ذكر مىكند,جامعه اسلامى اولين مسائلى خانواده مدرسه كودكان آموزش داده مىشود اصول فروع دين شمار فروغ دين فرع هفتم هشتم امر معروف نهى منكر ذكر مىكند
اهل سنت تعين امام وظايف امت داند فروغ دين شناسند,اهل سنت تعين امام وظايف امت داند فروع دين شناسند
ضد نمادهاي اصول فروغ دين نهادهاي برخاسته,ضد نمادهاي اصول فروع دين نهادهاي برخاسته
پيغمبري متكاهاي اصول فروغ دين درماندگي بيماري رواني جهاني برده بوده,پيغمبري متكاهاي اصول فروع دين درماندگي بيماري رواني جهاني برده بوده
نظر عمل تأويل اصول فروغ دين تفسير رأي مفسران دچار گشت,نظر عمل تأويل اصول فروع دين تفسير رأي مفسران دچار گشت
جهاد حافظ بقاي ساير اصول فروغ دين معني,جهاد حافظ بقاي ساير اصول فروع دين معني
بچه بچه رژ حج دهنده حالا كسي استفاده,بچه بچه رژ حجم دهنده حالا كسي استفاده
كران فيلم موهن طريق ملاقات مقام بلند پايه دولتي,اكران فيلم موهن طريق ملاقات مقام بلند پايه دولتي
كران فيلم كوتاه,اكران فيلم كوتاه
كران فيلم اخلاقي گلشيفته آمريكا,اكران فيلم اخلاقي گلشيفته آمريكا
كران فيلم پولي ساخته حميد نعمتاله 25 شهريور آستانه عيد سعيد فطر,اكران فيلم پولي ساخته حميد نعمتاله 25 شهريور آستانه عيد سعيد فطر
كران فيلم سينماي اخراجيها 2 كارگرداني مسعود دهنمكي شنبه 19 بهمن بخش مسابقه فيلمهاي اول دوم بيست هفتمين جشنواره فيلم فجر آغاز ميشود,اكران فيلم سينماي اخراجيها 2 كارگرداني مسعود دهنمكي شنبه 19 بهمن بخش مسابقه فيلمهاي اول دوم بيست هفتمين جشنواره فيلم فجر آغاز ميشود
ابراز وسايل موسيقي,ابزار وسايل موسيقي
بدام انداختن نابودي ابراز وسايل انسان نيروهاي مرموز ناشناخته اندازد,بدام انداختن نابودي ابزار وسايل انسان نيروهاي مرموز ناشناخته اندازد
انسان موجودي اجتماعي وناگزيربه برقراري ارتباط وفراهم كردن ابراز وسايل ارتباط ضروري عين مهم,انسان موجودي اجتماعي وناگزيربه برقراري ارتباط وفراهم كردن ابزار وسايل ارتباط ضروري عين مهم
نظر ابراز وسايل غني ثروتمنديم,نظر ابزار وسايل غني ثروتمنديم
سوي ابراز وسايل نسبتاً ابتداي متداول روابط عمومي نميتوان جامعه تاثير گذاشت,سوي ابزار وسايل نسبتاً ابتداي متداول روابط عمومي نميتوان جامعه تاثير گذاشت
ترين ابر يارانه جهان,ترين ابر رايانه جهان
مهمترين ابراز وسايل شكنجه بازداشتگاه موارد اشاره كرد,مهمترين ابزار وسايل شكنجه بازداشتگاه موارد اشاره كرد
ابراز وسايل استيل گرانيتي كامل شوند,ابزار وسايل استيل گرانيتي كامل شوند
مهمترين عل بروز آسيبهاي بدني گرم نكردن بدن عدم آمادگي جسماني محيط نامناسب ورزشي ابراز وسايل غيراستاندارد برخوردهاي بدني ورزشكاران باشد,مهمترين عل بروز آسيبهاي بدني گرم نكردن بدن عدم آمادگي جسماني محيط نامناسب ورزشي ابزار وسايل غيراستاندارد برخوردهاي بدني ورزشكاران باشد
استفاده ابراز وسايل پيشرفته دستگاه رسانه واقعيتي انكار ناپذير عنوان كرد,استفاده ابزار وسايل پيشرفته دستگاه رسانه واقعيتي انكار ناپذير عنوان كرد
مثال استفاده ابراز وسايل جاذب انرژي نصب فيلترهاي الكترونيكي مخصوص توان بازتاب انرژي كاسته,مثال استفاده ابزار وسايل جاذب انرژي نصب فيلترهاي الكترونيكي مخصوص توان بازتاب انرژي كاسته
دادن تسهيلات بانكي حمايت لازم تأسيس هتل سالن غذاخوري ابراز وسايل تفريحي ساز برگ ضروري مراكز جهان گردي بخش خصوصي,دادن تسهيلات بانكي حمايت لازم تأسيس هتل سالن غذاخوري ابزار وسايل تفريحي ساز برگ ضروري مراكز جهان گردي بخش خصوصي
استفاده ابراز وسايل سازنده كودك احساسات شيوه نكوتري ابراز,استفاده ابزار وسايل سازنده كودك احساسات شيوه نكوتري ابراز
روزي خواستم ابراز وسايل بياورند ساعتي ورزش كنيم,روزي خواستم ابزار وسايل بياورند ساعتي ورزش كنيم
نسخ خطي سكه عهدقاجار سفالينه دوره ابراز وسايل شناسي ظروف مطبخ وسايل مربوط آشپزي ابراز ادوات كشاورزي,نسخ خطي سكه عهدقاجار سفالينه دوره ابزار وسايل شناسي ظروف مطبخ وسايل مربوط آشپزي ابراز ادوات كشاورزي
بين بهم فكر نكن غم قصه نخور,بين بهم فكر نكن غم غصه نخور
غم قصه هامو نميدونم,غم غصه هامو نميدونم
كسي طريقي شكلي دلش غم قصه داره,كسي طريقي شكلي دلش غم غصه داره
ميدانيم غم قصه آرامشي رسيد,ميدانيم غم غصه آرامشي رسيد
غم قصه رابطه زيباي,غم غصه رابطه زيباي
غم قصه تحصيل هنري,غم غصه تحصيل هنري
موسيقي سازي تعزيه استفاده سار بادي انواع سرنا كرنا كوبه انواع دهل نقاره خلاصه,موسيقي سازي تعزيه استفاده ساز بادي انواع سرنا كرنا كوبه انواع دهل نقاره خلاصه
يه سار دهني گرفتم استادي ندارم شروع چكاركنم,يه ساز دهني گرفتم استادي ندارم شروع چكاركنم
عزيز مشرقين مغربين دليلي گروي بودن زمين نيست مغلطه نفرمائيد,عزيز مشرقين مغربين دليلي كروي بودن زمين نيست مغلطه نفرمائيد
گره زمين ساخت,كره زمين ساخت
فراموش ميكنيم بندي جلومونو گرفته بنده كفش خودمونه نبستيم,فراموش ميكنيم بندي جلومونو گرفته بند كفش خودمونه نبستيم
مشكل اقتصادي دست گريان,مشكل اقتصادي دست گريبان
رمشك مشكلات اقتصادي متعد دست گريان,رمشك مشكلات اقتصادي متعد دست گريبان
فشارخون عوارضي افراد مبتلا ديابت دست گريان,فشارخون عوارضي افراد مبتلا ديابت دست گريبان
روزها مشكلات فراواني دست گريان نگذارد,روزها مشكلات فراواني دست گريبان نگذارد
باآن پيامدهايش صورت جدي دست گريان باشند,باآن پيامدهايش صورت جدي دست گريبان باشند
آلودگي هوا مساله جهاني بيش 130كشور جهان كشورهاي درحال توسعه باآن پيامدهايش بهصورت جدي دست گريان باشند,آلودگي هوا مساله جهاني بيش 130كشور جهان كشورهاي درحال توسعه باآن پيامدهايش بهصورت جدي دست گريبان باشند
وزارت بهداشت روسيه درطرحي اجتماعي اقدام نصب صندوقهائي نموده افرادي باكودكان ويانامشروع دست گريان,وزارت بهداشت روسيه درطرحي اجتماعي اقدام نصب صندوقهائي نموده افرادي باكودكان ويانامشروع دست گريبان
بشر دست گريان,بشر دست گريبان
مشكلات امنيتي دست گريان ساحات جنوب شرقي كشور ظرف سال گذشته منطقه 9 تن كشته 9 تن دشمنان اختطاف شدهاند,مشكلات امنيتي دست گريبان ساحات جنوب شرقي كشور ظرف سال گذشته منطقه 9 تن كشته 9 تن دشمنان اختطاف شدهاند
غرب دستاورد سوم دولت رفاهي دست گريان,غرب دستاورد سوم دولت رفاهي دست گريبان
مهاجر مقيم ايران دها مشكل مالي دارند فشارهاي رواني واقتصادي دست گريان,مهاجر مقيم ايران دها مشكل مالي دارند فشارهاي رواني واقتصادي دست گريبان
خدا بنده وبلاگ وزين سوال طرح كرد بني بشر زمان هبوط آدم حوا دست گريان,خدا بنده وبلاگ وزين سوال طرح كرد بني بشر زمان هبوط آدم حوا دست گريبان
مشكلاي كودكي باهاش دست گريان بودم حسود نبودنِ بيش حده,مشكلاي كودكي باهاش دست گريبان بودم حسود نبودنِ بيش حده
ادعاي اقتصاد دانان كشور تاكيد دارند مشكل يارانه مشكلي ريشه دار اقتصاد كشور دولتهاي محترم دست گريان,ادعاي اقتصاد دانان كشور تاكيد دارند مشكل يارانه مشكلي ريشه دار اقتصاد كشور دولتهاي محترم دست گريبان
ترافيك چالوس بحث تازهاي نيست سالها شهروندان شهر معضل دست گريان,ترافيك چالوس بحث تازهاي نيست سالها شهروندان شهر معضل دست گريبان
تراورس چوبي كشور رويه توان تهيه كرد,تراورس چوبي كشور روسيه توان تهيه كرد
رويه شاد دارند حفظ روحيه شاد ورزش مثبت نگري دوري افكار منفي افراد منفي گرا برگزيده,روحيه شاد دارند حفظ روحيه شاد ورزش مثبت نگري دوري افكار منفي افراد منفي گرا برگزيده
ين آمار آخرين مطالعه انجام سوى گروه تحقيقات اكوفيزيولوژيكى مؤسه تحقيقات جنگل مرتفع سازمان جنگل مراتع آبخيزدارى ارايه,ين آمار آخرين مطالعه انجام سوى گروه تحقيقات اكوفيزيولوژيكى مؤسه تحقيقات جنگل مرتع سازمان جنگل مراتع آبخيزدارى ارايه
ارزش اقتصادي جنگل مرتفع هزينه عمراني پروژها محاسبه,ارزش اقتصادي جنگل مرتع هزينه عمراني پروژها محاسبه
بازديد آثار مانده تمدن عيلام پهنه زاگرس مشكلات متعد جنگل مرتفع نمايان,بازديد آثار مانده تمدن عيلام پهنه زاگرس مشكلات متعد جنگل مرتع نمايان
حفاظت آب خاك جنگل مرتفع وظيفه دانست حفاظت منابع تاكيد كرد,حفاظت آب خاك جنگل مرتع وظيفه دانست حفاظت منابع تاكيد كرد
طرفش امدي خوردي تلخ گفتي شيره گاو بهم بده دهنم تلخ,طرفش امدي خوردي تلخ گفتي شير گاو بهم بده دهنم تلخ
شيره گاو لواشك ورم قرار,شير گاو لواشك ورم قرار
آرون بچه شيره گاو ميدوشيده,آرون بچه شير گاو ميدوشيده
شيرشون شيره گاو پنير كره كشك,شيرشون شير گاو پنير كره كشك
حذف رايانه خوراكهاي فرهنگي جامعه لطمه وارد ميكند,حذف يارانه خوراكهاي فرهنگي جامعه لطمه وارد ميكند
صنعت هتلداري حذف رايانه انرژي تهديد,صنعت هتلداري حذف يارانه انرژي تهديد
پروين ناصر حجاري تجليل,پروين ناصر حجازي تجليل
اعلام بيكاري ايدز جهان گسترش,اعلام بيماري ايدز جهان گسترش
سال 1983 دريافت كرد بيكاري ايدز مبتلا بستر مرگ افتاد,سال 1983 دريافت كرد بيماري ايدز مبتلا بستر مرگ افتاد
ميانگين نرخ بيماري مرز درصد گذشت,ميانگين نرخ بيكاري مرز درصد گذشت
نرخ بيماري بيش درصد افزايش نسبت ماه اخر سال رقمي حد درصد رسيده,نرخ بيكاري بيش درصد افزايش نسبت ماه اخر سال رقمي حد درصد رسيده
فرايند حد تيك ملي 10 صبح ادامه داشت,فرايند حد تيم ملي 10 صبح ادامه داشت
بازيكني برو تيك ملي نجات بده اونجا غلطي نميكني,بازيكني برو تيم ملي نجات بده اونجا غلطي نميكني
آقاي صوفي سرمربي تيك ملي واليبال افغانستان,آقاي صوفي سرمربي تيم ملي واليبال افغانستان
بچه تيك ملي واليبال تايلند برگشته كادوي دادن خوبه باشه,بچه تيم ملي واليبال تايلند برگشته كادوي دادن خوبه باشه
مطمئنم رحمتي تيك ملي گيري,مطمئنم رحمتي تيم ملي گيري
اومد تيك ملي بازيهاي مقدماتي تيمها راحتي ميبرد,اومد تيم ملي بازيهاي مقدماتي تيمها راحتي ميبرد
همنواي گوشم تيم تاك ساعت صداي عجيبي هرازگاهي يخچال درمياد,همنواي گوشم تيك تاك ساعت صداي عجيبي هرازگاهي يخچال درمياد
شنيدن صداي تيم تاك ساعت,شنيدن صداي تيك تاك ساعت
شب زن دزد زايمان گرفت,شب زن درد زايمان گرفت
باد وزيد طوفان باران بريدن گرفته افتاب ابرها رخ نمايان كرد مينويسم,باد وزيد طوفان باران باريدن گرفته افتاب ابرها رخ نمايان كرد مينويسم
بغض گلويم گير ميشد اندازه باران بريد حوالي,بغض گلويم گير ميشد اندازه باران باريد حوالي
باران بريد باريد,باران باريد باريد
باران بريد,باران باريد
اوين خصوص ماجرا سخن ميگويد,اولين خصوص ماجرا سخن ميگويد
اوين ايران مجوز دولت,اولين ايران مجوز دولت
اوين تاسيسات آب شركت آبفاي استان يزد,اولين تاسيسات آب شركت آبفاي استان يزد
