cleaned_wrong_sentence,cleaned_true_sentence
جايگزين گياهي آسپيرين گوجه فرهنگي,جايگزين گياهي آسپيرين گوجه فرنگي
كاهش قيمت گوجه فرنگي خيار ميادين ميوه ترهبار,كاهش قيمت گوجه فرنگي خيار ميادين ميوه ترهبار
خوردن گوجه فرهنگي حرام,خوردن گوجه فرنگي حرام
گوجه فرهنگي,گوجه فرنگي
سيب زميني 580 كيلو گوجه فرهنگي 180 كيلو,سيب زميني 580 كيلو گوجه فرنگي 180 كيلو
اجازه فروش كارخانه كشمش رب گوجه فرهنگي تاكستان وزارت صنايع,اجازه فروش كارخانه كشمش رب گوجه فرنگي تاكستان وزارت صنايع
كشف ژن جديد گوجه فرهنگي امكان توليد ميوهاي شيرينتر فراهم,كشف ژن جديد گوجه فرنگي امكان توليد ميوهاي شيرينتر فراهم
خداحافظي محمدبنا كشتي فرهنگي ايران,خداحافظي محمدبنا كشتي فرنگي ايران
محروم نشدن سرمربي تيم ملي جوانان كشتي فرهنگي ايران,محروم نشدن سرمربي تيم ملي جوانان كشتي فرنگي ايران
دومين طلاي ايران كشتي فرهنگي,دومين طلاي ايران كشتي فرنگي
سرمربي تيم كشتي فرهنگي پاداشهاي عبدولي بدهند,سرمربي تيم كشتي فرنگي پاداشهاي عبدولي بدهند
كشتي فرهنگي ايذه ليگ برتر كشتي فرنگي كشور,كشتي فرهنگي ايذه ليگ برتر كشتي فرنگي كشور
كردستان قهرمان مسابقات قهرماني كشتي فرهنگي پيام نور كشور,كردستان قهرمان مسابقات قهرماني كشتي فرنگي پيام نور كشور
برهمين اساس قرار چهره سرشناس سينما ورزشكاران كنسرت حضور پيدا حمايت حركت فرنگي اجتماعي رستاي كمك زلزله زدگان قدم بردارند,برهمين اساس قرار چهره سرشناس سينما ورزشكاران كنسرت حضور پيدا حمايت حركت فرهنگي اجتماعي رستاي كمك زلزله زدگان قدم بردارند
صفحه براى نويسى زيان فارسي بوده صفحه براى نوشتن هاى فارسى استفاده مى,صفحه براى نويسى زبان فارسي بوده صفحه براى نوشتن هاى فارسى استفاده مى
تنظيم زيان فارسي منوي,تنظيم زبان فارسي منوي
قالب ورزشي جوملا داراي پشتيباني زيان فارسي انگليسي نصب,قالب ورزشي جوملا داراي پشتيباني زبان فارسي انگليسي نصب
مشكل ساير دروس صحبت معلم نوشته كتابها مرحله اول زبان مادري ترجمه درك پردازد تكرار زباني زيان مادري ترجمه كودكي نتواند مفاهيم درك نمايد طبع توان بيان نخواهد داشت,مشكل ساير دروس صحبت معلم نوشته كتابها مرحله اول زبان مادري ترجمه درك پردازد تكرار زباني زبان مادري ترجمه كودكي نتواند مفاهيم درك نمايد طبع توان بيان نخواهد داشت
عكس زبان مادري فرايند يادگيري زيان بيگانه زبان دوم سوم روند آگاهانه انتخابي,عكس زبان مادري فرايند يادگيري زبان بيگانه زبان دوم سوم روند آگاهانه انتخابي
نظريه آموزش زيان مادري كمبودهاي زيادي برخوردار,نظريه آموزش زبان مادري كمبودهاي زيادي برخوردار
منو ماميم ميرفتيم شمال منار دريا,منو ماميم ميرفتيم شمال دريا
مسير سرسبز منار دريا دوچرخه برم,مسير سرسبز دريا دوچرخه برم
حالا تفريح سرگرمي امكانات تسهيلاتي برخوردار بودند توانست جايگزين مسافرت ده منار دريا باشد روزهاي جمعه ساير روزهاي تعطيلي هفته توانستند تنوع جالبي بهره مند شوند آزادي عمل بيشتري داشتند,حالا تفريح سرگرمي امكانات تسهيلاتي برخوردار بودند توانست جايگزين مسافرت ده دريا باشد روزهاي جمعه ساير روزهاي تعطيلي هفته توانستند تنوع جالبي بهره مند شوند آزادي عمل بيشتري داشتند
فيلم بينيم مشغول هل دادن خودروي منار ساحل گل نشسته صحنه استعاره شخصيت ارزش سقوط نامزد بينيم اساس شنيده ذهن محكوم خيانتكار تصور جسد تحويل بگيرد سمت تهران حركت,فيلم بينيم مشغول هل دادن خودروي ساحل گل نشسته صحنه استعاره شخصيت ارزش سقوط نامزد بينيم اساس شنيده ذهن محكوم خيانتكار تصور جسد تحويل بگيرد سمت تهران حركت
عاشقانه منار ساحل غروب كردنه افتاب نگاه ميكني دنيا زيباست,عاشقانه ساحل غروب كردنه افتاب نگاه ميكني دنيا زيباست
همراه دكتر منار ساحل رفت باران نم نم باريد,همراه دكتر ساحل رفت باران نم نم باريد
فرم مطلب برخدم ايراني مستي شهرهاي تايلند منار ساحل مشغول بوند پليس اونهارو دستگير جريمه ميكنه,فرم مطلب برخدم ايراني مستي شهرهاي تايلند ساحل مشغول بوند پليس اونهارو دستگير جريمه ميكنه
ماه اولين بارت رفتي شمال منار دريا بابا رامسر هتل ملكشاه اتاق رزرو ظهرش اونجا بوديم فرداشم بازم اومدي منار دريا وجودي مه خوابت ميومد بودي دختر ارومي بودي اجازه دادي بابا بگذره,ماه اولين بارت رفتي شمال منار دريا بابا رامسر هتل ملكشاه اتاق رزرو ظهرش اونجا بوديم فرداشم بازم اومدي دريا وجودي مه خوابت ميومد بودي دختر ارومي بودي اجازه دادي بابا بگذره
كسي منار دريا دنيا آمده باشد گذر رود,كسي دريا دنيا آمده باشد گذر رود
گذشتها علاقه زيادي اشياي كهنه قديمي ولع خاصي نگاهداري ميكند نحوي بتوانيد اسباب اثاثيه خصوصي بگرديد كمال تعجب چيزهاي كهنهاي پيدا ميكنيد سالها عمرشان گذشته بلوزي مد افتاده گيره موي چنيد سال قبل منار دريا خريده يكبار استفاده قرار نگرفته جوراب پارهاي ده سال ميپوشيد كوهنوردي ميرفت قابعكس شكستهاي روزگاهري عكس پدربزرگ,گذشتها علاقه زيادي اشياي كهنه قديمي ولع خاصي نگاهداري ميكند نحوي بتوانيد اسباب اثاثيه خصوصي بگرديد كمال تعجب چيزهاي كهنهاي پيدا ميكنيد سالها عمرشان گذشته بلوزي مد افتاده گيره موي چنيد سال قبل دريا خريده يكبار استفاده قرار نگرفته جوراب پارهاي ده سال ميپوشيد كوهنوردي ميرفت قابعكس شكستهاي روزگاهري عكس پدربزرگ
پك پاك كنده مقابلتان مشاهده كنيد پر كاربرد ترين وسائل جانبي دستگاه داراي ال سي دي,پك پاك كنده مقابلتان مشاهده كنيد پر كاربرد ترين وسائل جانبي دستگاه داراي ال سي دي
انلاين هست سرگرم كنده ومعتاد كنده هيجان انگيز,انلاين هست سرگرم كنده ومعتاد كنده هيجان انگيز
طنزنويسان بداند بقاي ستون طنز مرهون عزيزان مسئولان بيايند توصيه دلسوزانه عمل طنزسازنده دل گرم كنده سرگرم كنده بنويسند هواي دل انگيز مهر لبخند بزند آواز پرندگان وسفيد پايزي غرق شادماني بشوند,طنزنويسان بداند بقاي ستون طنز مرهون عزيزان مسئولان بيايند توصيه دلسوزانه عمل طنزسازنده دل گرم كنده سرگرم كنده بنويسند هواي دل انگيز مهر لبخند بزند آواز پرندگان وسفيد پايزي غرق شادماني بشوند
خانواده مراقب تهاجم فرهنگي كودكان نوجوانان تجهيزات سرگرم كنده انجام باشند,خانواده مراقب تهاجم فرهنگي كودكان نوجوانان تجهيزات سرگرم كنده انجام باشند
كارتون باربي پري زيباي كارتون سرگرم كنده دوست داشتني داراي داستاني امروزي جذاب آموزنده باشد,كارتون باربي پري زيباي كارتون سرگرم كنده دوست داشتني داراي داستاني امروزي جذاب آموزنده باشد
نقدر داغون كوچيكترين خبر ناراحت كنده گريه ميكنم,نقدر داغون كوچيكترين خبر ناراحت كنده گريه ميكنم
تفريحات سرگرم كنده نيست,تفريحات سرگرم كنده نيست
علت ايام تابستان ميبايست پر مخاطب سرگرم كنده اوقات فراغت پر كنيم يكباره,علت ايام تابستان ميبايست پر مخاطب سرگرم كنده اوقات فراغت پر كنيم يكباره
كوتاه مساله مهمي ميخواد نشون بده ريتمش كنده نكات بيشتري داشته باشه,كوتاه مساله مهمي ميخواد نشون بده ريتمش كنده نكات بيشتري داشته باشه
قبل خاط حرف تعجب كنيد بگيد عصبانيته هست دوست عزيز ناراحت حرف اتفاقي محيطبان افتاد ناراحت كنده اتفاقات چندسال سرهم داره اتفاق افته سال كشته محيطبان كورشدن همكارش منطقه سهند2 تبريز كشته محيطبان كوهاي كردستان وخيلياي استان جزيره پارك ملي ارسباران,قبل خاط حرف تعجب كنيد بگيد عصبانيته هست دوست عزيز ناراحت حرف اتفاقي محيطبان افتاد ناراحت كنده اتفاقات چندسال سرهم داره اتفاق افته سال كشته محيطبان كورشدن همكارش منطقه سهند2 تبريز كشته محيطبان كوهاي كردستان وخيلياي استان جزيره پارك ملي ارسباران
وبالگ مرتبط صنعت خودرو فناوري مرتبط دعوا همكاري تبادل لينك نمايم,وبالگ مرتبط صنعت خودرو فناوري مرتبط دعوت همكاري تبادل لينك نمايم
اسكريپتي شناسه رمز ياهو بديم اد ليست دعوا نامه ارسال كنه,اسكريپتي شناسه رمز ياهو بديم اد ليست دعوت نامه ارسال كنه
كتابهاي دانشگاه جامع علني كاربردي منظور كتاب درسي مذكور دانشگاه جامع علمي كاربردي تدوين تعين,كتابهاي دانشگاه جامع علمي كاربردي منظور كتاب درسي مذكور دانشگاه جامع علمي كاربردي تدوين تعين
سلام جواب آزمون علني كاربردي دوره ترمي سال 90 ميآيد,سلام جواب آزمون علمي كاربردي دوره ترمي سال 90 ميآيد
سايت مركز علني كاربردي جاجرم راه اندازي گرديد,سايت مركز علمي كاربردي جاجرم راه اندازي گرديد
اول شخص علني تخيلي حاوي عناصري بازيهاي جديد انتظار هستيم پايان اجازه ميدهد راه دلخواهتان كار انجام دهيد,اول شخص علمي تخيلي حاوي عناصري بازيهاي جديد انتظار هستيم پايان اجازه ميدهد راه دلخواهتان كار انجام دهيد
پرونده موضوعي نشريه عنوان سينماي علني تخيلي مقاله ياداشتهاي حسن گيتي محسن سيف منوچهر اكبرلو مجيد روانجو هادي معيرينژاد محمد هاشمي محمد طاهري محمدرضا لطفي نزهت بادي الناز ديمان چاپ رسيده,پرونده موضوعي نشريه عنوان سينماي علمي تخيلي مقاله ياداشتهاي حسن گيتي محسن سيف منوچهر اكبرلو مجيد روانجو هادي معيرينژاد محمد هاشمي محمد طاهري محمدرضا لطفي نزهت بادي الناز ديمان چاپ رسيده
ماجراجوي علمي مؤيد تفسير ديني دنيا نيست ملو امور عادي ميل امور متعالي ژانرعملي تخيلي وارد,ماجراجوي علمي مؤيد تفسير ديني دنيا نيست ملو امور عادي ميل امور متعالي علمي تخيلي وارد
دين مانده بدوي معرفي ميشد نقش داستان تخيلي تضعيف ميشد حاكي تمدن ضعيف نژادهاي غريبه,دين مانده بدوي معرفي ميشد نقش داستان علمي تخيلي تضعيف ميشد حاكي تمدن ضعيف نژادهاي غريبه
سناريوي خاص طرق داستان تخيلي رواج,سناريوي خاص طرق داستان علمي تخيلي رواج
نويسندگان داستانهاي تخيلي برداشت عمومي تاريخ عنوان روند دايرهاي دين نقطهاي چرخه ديدند انسانها طريق تاريخ تمدن جدا شوند فراموش خواهند,نويسندگان داستانهاي علمي تخيلي برداشت عمومي تاريخ عنوان روند دايرهاي دين نقطهاي چرخه ديدند انسانها طريق تاريخ تمدن جدا شوند فراموش خواهند
كلينكنبورگ مقاله برسي داستان علمي تخيلي پرداخته نتيجه گيري داستان علمي تخيلي فرآورده فلسفه,كلينكنبورگ مقاله برسي داستان علمي تخيلي پرداخته نتيجه گيري داستان علمي تخيلي فرآورده فلسفه
مامي حقوق وب سايت متعلق مركز آموزش عالي كاربردي كانون وكلاي دادگستري مركز ميباشد,مامي حقوق وب سايت متعلق مركز آموزش عالي علمي كاربردي كانون وكلاي دادگستري مركز ميباشد
مركز كاربردي باشگاه پرسپوليس حضور ريس فدراسيون فوتبال اعضاي هيئت مديره باشگاه پرسپوليس افتاح,مركز علمي كاربردي باشگاه پرسپوليس حضور ريس فدراسيون فوتبال اعضاي هيئت مديره باشگاه پرسپوليس افتاح
نكته قابل توجه درخصوص سهگانه ترنسفورمرز موضوع دشمني آدمفضايها دولت آمريكا پارت اول سازندگان فيلم تخيلي ترجيح دادهاند متوقف كردن هستهاي ايران آدمفضايها دولت آمريكا متحد,نكته قابل توجه درخصوص سهگانه ترنسفورمرز موضوع دشمني آدمفضايها دولت آمريكا پارت اول سازندگان فيلم علمي تخيلي ترجيح دادهاند متوقف كردن هستهاي ايران آدمفضايها دولت آمريكا متحد
هواي تخيلي اكشن قصه اندر فيلم ساز تاكيد ميكند بخش مهمي قصه ارتباط روابط عاطفي آدمها شرايط,هواي علمي تخيلي اكشن قصه اندر فيلم ساز تاكيد ميكند بخش مهمي قصه ارتباط روابط عاطفي آدمها شرايط
ريس دانشگاه كاربردي استان زنجان گفت,ريس دانشگاه علمي كاربردي استان زنجان گفت
پيشانى موجودات جهان مى توانيم نشانه عمل دانش مبدأ بخوانيم نشانه نداشتن علم دانش مبدأ,پيشانى موجودات جهان مى توانيم نشانه علم دانش مبدأ بخوانيم نشانه نداشتن علم دانش مبدأ
كسي پوشيده نيست پژوهش توليد عمل دانش شخص كشور ميتواند صورت گيرد,كسي پوشيده نيست پژوهش توليد علم دانش شخص كشور ميتواند صورت گيرد
سال 1960 تمايز تربيت دانش آموزش پرورش پداگوژي امكان پذير مكن تربيت نوعي عمل دانش آموزش پرورش نوعي تفكر شمرد,سال 1960 تمايز تربيت دانش آموزش پرورش پداگوژي امكان پذير مكن تربيت نوعي علم دانش آموزش پرورش نوعي تفكر شمرد
تعاليم عمل دانش تفكر آفرينش دعوت كرد آيات قرآني پيشگام بيان حقايق هستي چگونگي رخدادهاي,تعاليم علم دانش تفكر آفرينش دعوت كرد آيات قرآني پيشگام بيان حقايق هستي چگونگي رخدادهاي
عمل دانش توانيم رفع مشكل آلودگي هوا صوت تهران بپردازيم,علم دانش توانيم رفع مشكل آلودگي هوا صوت تهران بپردازيم
سردبير نشريه انتشارات مشترك دانشگاه عمل صنعت ايران,سردبير نشريه انتشارات مشترك دانشگاه علم صنعت ايران
افشين شريعت مهيمني استاديار دانشكده مهندسي عمران دانشگاه عمل صنعت ايران,افشين شريعت مهيمني استاديار دانشكده مهندسي عمران دانشگاه علم صنعت ايران
صالحي وزير امور خارج ايران پنجشنبه اعلام كرد,صالحي وزير امور خارجه ايران پنجشنبه اعلام كرد
اكتبر وزير امور خارج بريتانيا ويليام هيگ سخنراني آكادمي بريتانيا حضور رئيس اعضاي آكادمي گزارش كوتاهي فعاليت سال اخير وزارت امور خارجه ارائه كرد,اكتبر وزير امور خارجه بريتانيا ويليام هيگ سخنراني آكادمي بريتانيا حضور رئيس اعضاي آكادمي گزارش كوتاهي فعاليت سال اخير وزارت امور خارجه ارائه كرد
ديدار وزير وزير امور خارج قرقيزستان,ديدار وزير وزير امور خارجه قرقيزستان
موضوع كلامى تاريخى سند صحيح باشد ياور اعتقاد نخواهد آورد,موضوع كلامى تاريخى سند صحيح باشد باور اعتقاد نخواهد آورد
فروش قيمت ياور نكردني,فروش قيمت باور نكردني
بگويم شكل ياور نكردني شانس باشند توانسته برساند,بگويم شكل باور نكردني شانس باشند توانسته برساند
نبايد ياد برد متخصان خلاقيت آموختني مختص كره مزين,نبايد ياد برد متخصان خلاقيت آموختني مختص كره زمين
مستندهاي مجلس مزين خواري اشرافيت مسئولين فقر محروميت ساخته,مستندهاي مجلس زمين خواري اشرافيت مسئولين فقر محروميت ساخته
تسهيلات ورزشي قبيل ميدان مزين كاركنان كارخانه خانواده برپا,تسهيلات ورزشي قبيل ميدان زمين كاركنان كارخانه خانواده برپا
مطمئن بشم ريس جمهور كشورهاي بوركينافاسو جزاير قمر سيشيل واتيكان صحبت كردم امار جهاني فعلي ميگه جمعيت كره مزين 7 ميليارد نفره دروغ محضه غرب اهداف استعماري مطرح,مطمئن بشم ريس جمهور كشورهاي بوركينافاسو جزاير قمر سيشيل واتيكان صحبت كردم امار جهاني فعلي ميگه جمعيت كره زمين 7 ميليارد نفره دروغ محضه غرب اهداف استعماري مطرح
بيني ام نازد انتخاباتي تعجب پرسيد قول دادني,بيني ام نامزد انتخاباتي تعجب پرسيد قول دادني
شب خواب درجه رفيق شهادت نائل گرد,شب خواب درجه رفيع شهادت نائل گرد
جام شهادت كشيد درجه رفيق اعلي پيوست,جام شهادت كشيد درجه رفيع اعلي پيوست
امام حسين قبل عاشورا درجه رفيق شهادت نائل,امام حسين قبل عاشورا درجه رفيع شهادت نائل
يه افزونه ميخوام كالري عكس بندي بشه موضوعات,يه افزونه ميخوام گالري عكس بندي بشه موضوعات
ساخت ظروف شكل پيكرهاي حيوانات قبيل بز كاو نر كوهاندار سگ گوزن رواج يافت ظروف آبريزي لبه ديده ميشود ريتوان ميگويند,ساخت ظروف شكل پيكرهاي حيوانات قبيل بز گاو نر كوهاندار سگ گوزن رواج يافت ظروف آبريزي لبه ديده ميشود ريتوان ميگويند
كاو نر مرد كهن,گاو نر مرد كهن
كمال تعجب ميبينيد كاو نر موفق بوده اسب نعل ميره,كمال تعجب ميبينيد گاو نر موفق بوده اسب نعل ميره
دانشگاهِ آزاد واحد ساوه نظر تعداد رأس گاو مازادِ نيازِ شامل رأس كاو نر رأس گاو ماده رأس تليسه طريق مزايده فروش برساند,دانشگاهِ آزاد واحد ساوه نظر تعداد رأس گاو مازادِ نيازِ شامل رأس گاو نر رأس گاو ماده رأس تليسه طريق مزايده فروش برساند
شير كاو دوشيد گاو سفيد دهيد گاو سفيد دوشيد,شير گاو دوشيد گاو سفيد دهيد گاو سفيد دوشيد
شير كاو خورد توانيد بجوشانيد شير سويا بدهيد,شير گاو خورد توانيد بجوشانيد شير سويا بدهيد
درجه بندي گوشت كاو,درجه بندي گوشت گاو
همبرگر گوشت كاو كوبه خرچنگ مين نوعي پياز خاص پنير بري سركه 10 تشكيل,همبرگر گوشت گاو كوبه خرچنگ مين نوعي پياز خاص پنير بري سركه 10 تشكيل
عصاره گوشت كاو مايعي ريختن گوشت خوك ونيم ساعت گوشت گاو تبديل ميكند,عصاره گوشت گاو مايعي ريختن گوشت خوك ونيم ساعت گوشت گاو تبديل ميكند
امريكا كاو ماده شير دوشد تقسيم,امريكا گاو ماده شير دوشد تقسيم
داستان كاو بني اسرايل اول خداوند انها كاو ماده سب عيب جويهاي انان شرايط انان ترو سختر ميشد,داستان گاو بني اسرايل اول خداوند انها كاو ماده سب عيب جويهاي انان شرايط انان ترو سختر ميشد
اساس پسر بچه ده اثر خوردن شاخ گام شكمش جراحت سختي برداشته بيمارستان بستري,اساس پسر بچه ده اثر خوردن شاخ گاو شكمش جراحت سختي برداشته بيمارستان بستري
شاخ گوزن شتر چشمان اهريمن گردن مار شكم صدف بزرگ فلس ماهي چنگال عقاب پنجه برو گوشهاي گام نر,شاخ گوزن شتر چشمان اهريمن گردن مار شكم صدف بزرگ فلس ماهي چنگال عقاب پنجه برو گوشهاي گاو نر
بختياريها ازشاخ پازن بزكوهي نر زنهاي انگشتر ميكند عقيده دارند انگشتر موقع دوشيدن گاو انگشت زن دوشنده باشد شير گام پر بركتر ميشود,بختياريها ازشاخ پازن بزكوهي نر زنهاي انگشتر ميكند عقيده دارند انگشتر موقع دوشيدن گاو انگشت زن دوشنده باشد شير گاو پر بركتر ميشود
نگراني هاش پسرش سير مادر خوره تشنج ذهن مامانش مشغول نوشته,نگراني هاش پسرش شير مادر خوره تشنج ذهن مامانش مشغول نوشته
