cleaned_wrong_sentence,cleaned_true_sentence
توقف مطبوعات عاملي تهديد امنيت ملي داند,توقيف مطبوعات عاملي تهديد امنيت ملي داند
بنده حقير مشمول عنايت قرار داده راه خدمتگزاري شريف نعمت مسئوليت توقيف افزون عطا فرمايد,بنده حقير مشمول عنايت قرار داده راه خدمتگزاري شريف نعمت مسئوليت توفيق افزون عطا فرمايد
آرزوي توقيف افزون دلاور عرصه خون خواريو خون ريزي,آرزوي توفيق افزون دلاور عرصه خون خواريو خون ريزي
آرزوي موفقيت اسكواش بازان ايران عرصه المل توقيف افزون مازندراني هاعزيز عرصه ورزش الخصوص اسكواش,آرزوي موفقيت اسكواش بازان ايران عرصه المل توفيق افزون مازندراني هاعزيز عرصه ورزش الخصوص اسكواش
بقيه بچه انان سپاس گذاريم خداوند منان ارزوي توقيف افزون انان ارزومنديم,بقيه بچه انان سپاس گذاريم خداوند منان ارزوي توفيق افزون انان ارزومنديم
سود صنايع غذاي بورس تخت تاثير گراني ونرخ دلار افزايش يافت,سود صنايع غذاي بورس تاثير گراني ونرخ دلار افزايش يافت
لوكمي سلولهاي مغز استخواني تخت تاثير قرار ميدهند,لوكمي سلولهاي مغز استخواني تاثير قرار ميدهند
نحوه تقسيط نيتروژن سطوح مختلف عملكرد غده تخت تاثير ثراد داد,نحوه تقسيط نيتروژن سطوح مختلف عملكرد غده تاثير ثراد داد
اوج شكوفاي دوره صفويه گردو تخت تاثير هنرهاي ارمني فرار داشته,اوج شكوفاي دوره صفويه گردو تاثير هنرهاي ارمني فرار داشته
اثرات ضدردي مورفين موش نر ماده متفاوت بوده احتمالاً تخت تاثير جنسيت قرار گيرد,اثرات ضدردي مورفين موش نر ماده متفاوت بوده احتمالاً تاثير جنسيت قرار گيرد
همسر اول پسر تخت تاثير زخم زبان ناجوامردانه پدر ترك تنهاي گذران زندگي,همسر اول پسر تاثير زخم زبان ناجوامردانه پدر ترك تنهاي گذران زندگي
پايه الگوهاي قديمي تخت تاثير فشارهاي رقابتي تبليغات سرمايهگذاري ميكند,پايه الگوهاي قديمي تاثير فشارهاي رقابتي تبليغات سرمايهگذاري ميكند
بچه خندند ديگردر ابتدا تخت تاثير قرار گيرند,بچه خندند ديگردر ابتدا تاثير قرار گيرند
هفته گذشت تخت تاثير برگزاري موفق اجلاس سران عدم تعهد تهران قرار داشت اخبار رسانه حاوي تحليل نتايج دستاوردهاي اجلاس,هفته گذشت تاثير برگزاري موفق اجلاس سران عدم تعهد تهران قرار داشت اخبار رسانه حاوي تحليل نتايج دستاوردهاي اجلاس
عنوان عواملي مشكلات مربوط سلامتي افراد تخت تاثير قرار,عنوان عواملي مشكلات مربوط سلامتي افراد تاثير قرار
اسلاوهاي جنوبي تخت تاثير موقعيتهاي جديد اسلام گرويدند,اسلاوهاي جنوبي تاثير موقعيتهاي جديد اسلام گرويدند
شناساي مناطق تخت تاثير فرسايش بادي,شناساي مناطق تاثير فرسايش بادي
عوامل اجتماعي فرهنگي جنبهاي رفتار مصرفكنده خريدار تخت تاثير قرار داده,عوامل اجتماعي فرهنگي جنبهاي رفتار مصرفكنده خريدار تاثير قرار داده
نتايج تحقيق نشان ميدهد فضاي گردشگري اصفهان تخت تأثير فضاي تاريخي شهر قرار گرفته بخش مركزي شهر پوش ميدهد,نتايج تحقيق نشان ميدهد فضاي گردشگري اصفهان تأثير فضاي تاريخي شهر قرار گرفته بخش مركزي شهر پوش ميدهد
سيم خنك بهاري,نسيم خنك بهاري
منو فرشته اينارو مدرسه واسه زنگ وزش ارائه داديم,منو فرشته اينارو مدرسه واسه زنگ ورزش ارائه داديم
بيش وزش تفريح فوتباليست زمان انگليس اهميت داشت ميل شورش وخراب كاري,بيش ورزش تفريح فوتباليست زمان انگليس اهميت داشت ميل شورش وخراب كاري
صفحه راهنماي علاقمندان فراگيري حرفه تكنيكهاي وزش شنا زمان كمترين هزينه طراح,صفحه راهنماي علاقمندان فراگيري حرفه تكنيكهاي ورزش شنا زمان كمترين هزينه طراح
حالت وزش شنا دقيقآ شبيه مشكل فضانوردان فضا,حالت ورزش شنا دقيقآ شبيه مشكل فضانوردان فضا
حسين آيت خصوص جايگاه وزش شنا كشور گفت,حسين آيت خصوص جايگاه ورزش شنا كشور گفت
رشد توسعه وزش شنا دركشور نظر بزودي آئين نامه اتحاديه استخرداران تدوين,رشد توسعه ورزش شنا دركشور نظر بزودي آئين نامه اتحاديه استخرداران تدوين
نظارت كنترل فعاليت آموزشي مربيان وزش صبحگاهي,نظارت كنترل فعاليت آموزشي مربيان ورزش صبحگاهي
نظر استاد وزش صبحگاهي تغذيه صحيح ورزش كردن ياد بگيرند,نظر استاد ورزش صبحگاهي تغذيه صحيح ورزش كردن ياد بگيرند
حضور سعيد لو معاون ريس جمهور ريس سازمان تربيت بدني وزش صبحگاهي اجرا خواهند نمود,حضور سعيد لو معاون ريس جمهور ريس سازمان تربيت بدني ورزش صبحگاهي اجرا خواهند نمود
آقاي قاسمي نژاد رئيس انجمن وزش صبحگاهي گروه باستاني كاران اقدام اجراي ورزش باستاني نمودند,آقاي قاسمي نژاد رئيس انجمن ورزش صبحگاهي گروه باستاني كاران اقدام اجراي ورزش باستاني نمودند
وزش گروهي فوتبال واليبال بسكتبال نياز رشد ارتقا داريم,ورزش گروهي فوتبال واليبال بسكتبال نياز رشد ارتقا داريم
ارزيد دانشگاه وزش انفرادي مسابقات دانشجو اعزام كنه,ارزيد دانشگاه ورزش انفرادي مسابقات دانشجو اعزام كنه
دوستداران وزش يوگا كشور كار آغاز پايان كلاس شركت كندگان لوح تقدير گواهي شركت كلاس اهدا,دوستداران ورزش يوگا كشور كار آغاز پايان كلاس شركت كندگان لوح تقدير گواهي شركت كلاس اهدا
خوابي 2 كمبود 3 آب بدن 3 فعاليت 4 استفاده آنتي بيوتيك 5 وزش هوازي 6 عدم مصرف مواد نشاسته 7عفونت 8 بيماري غد 9 نشستن 10كمبود ويتامين بدن,خوابي 2 كمبود 3 آب بدن 3 فعاليت 4 استفاده آنتي بيوتيك 5 ورزش هوازي 6 عدم مصرف مواد نشاسته 7عفونت 8 بيماري غد 9 نشستن 10كمبود ويتامين بدن
راهش وزش كردن اصولي نظر مربي بدنسازي هست ورزش تغذيه تونه يافتني بكنه,راهش ورزش كردن اصولي نظر مربي بدنسازي هست ورزش تغذيه تونه يافتني بكنه
ميگويد وزش كردن 30 دقيقه وقت نداريد,ميگويد ورزش كردن 30 دقيقه وقت نداريد
دشوي رفتن سب زود بيدا مدرسه بروم وزش كردن كوله,دشوي رفتن سب زود بيدا مدرسه بروم ورزش كردن كوله
مكنه مور وزش كردن ماه رمضان توضيح,مكنه مور ورزش كردن ماه رمضان توضيح
همونطور خانوما وزش كردن تناسب اندام رسيدن,همونطور خانوما ورزش كردن تناسب اندام رسيدن
وزش كردن مانع تحصيل نيست بهبود روند كارهاي فكري تقويت حافظه پيشرفته تحصيلي افزايش,ورزش كردن مانع تحصيل نيست بهبود روند كارهاي فكري تقويت حافظه پيشرفته تحصيلي افزايش
نوجوانان خصوص استفاده فرصت وزش كردن مطالبي عنوان كرد,نوجوانان خصوص استفاده فرصت ورزش كردن مطالبي عنوان كرد
ضمن فرموديد وزش كردن مفيده حرف,ضمن فرموديد ورزش كردن مفيده حرف
درمقوله ورزش بچه فرصت وزش كردن داشته باشند,درمقوله ورزش بچه فرصت ورزش كردن داشته باشند
وزش كردن باعث نفس نفس زدن ميشه هواي سرد حنجره ره ضر داره,ورزش كردن باعث نفس نفس زدن ميشه هواي سرد حنجره ره ضر داره
وقت زيادي وزش كردن مناسب,وقت زيادي ورزش كردن مناسب
تكنولوژي علم مخصوصا ضمينه ميكنم وزش كردن دوست دارم,تكنولوژي علم مخصوصا ضمينه ميكنم ورزش كردن دوست دارم
ساكت آرم نشسته نگاه جمعيت دوخته,ساكت نشسته نگاه جمعيت دوخته
آذر تفاوتي هايم گويد ساكت آرم نشيند مشغول كار,آذر تفاوتي هايم گويد ساكت نشيند مشغول كار
آسمان سكوت ميبرد ساكت آرم,آسمان سكوت ميبرد ساكت
زمان آرم ساكت,زمان ساكت
داستان پسر مجرد آرم ساكت شلوغ پر شيطنت,داستان پسر مجرد ساكت شلوغ پر شيطنت
عاشقم جان جفا بازم عشقش زبان آرم ساكت ته بتكده بنشينم,عاشقم جان جفا بازم عشقش زبان ساكت ته بتكده بنشينم
آرم ساكت خانه ات آسوده هستي,ساكت خانه ات آسوده هستي
دانشگاه عنوان دختر آرم ساكت ميشناسن دوست داره باشه,دانشگاه عنوان دختر ساكت ميشناسن دوست داره باشه
ول كن كنه شتري,ول كن كينه شتري
انتها نان زرد تخم مرغ ميماليم,در انتها نانها زرده تخم مرغ میمالیم
تخم مرغ زرد سفيده جدا,تخم مرغ زرده سفيده جدا
زرد تخم مرغ شير مخلوط ميكنيم,زرده تخم مرغ شير مخلوط ميكنيم
شيريني پفكي پخته بودم زرد تخم مرغ ميشه,شيريني پفكي پخته بودم زرده تخم مرغ ميشه
زرد تخم مرغ استكان ماند,زرده تخم مرغ استكان ماند
گير دادن كشت ارشاد زن شوهر جواب جالبه بخوانيد,گير دادن گشت ارشاد زن شوهر جواب جالبه بخوانيد
مد يارانه واز طريق رايانه ساعتها كشت گذار سايتها پرداخته فيس بوك تويتر يو توب امثال نشئه شوند,مد يارانه واز طريق رايانه ساعتها گشت گذار سايتها پرداخته فيس بوك تويتر يو توب امثال نشئه شوند
سايت ديدن دانلود كشت گذار انتخاب نموده ايد كمال تشكر داريم,سايت ديدن دانلود گشت گذار انتخاب نموده ايد كمال تشكر داريم
كشت گذار وب نظرات تارنماهاي گوناگون فيس بوك شبكه اجتماعي نتيجه خواهيد رسيد,گشت گذار وب نظرات تارنماهاي گوناگون فيس بوك شبكه اجتماعي نتيجه خواهيد رسيد
روزها شهروندي كشت گذار كوتاهي خيابان تهران داشته باشد,روزها شهروندي گشت گذار كوتاهي خيابان تهران داشته باشد
اينترنت كشت گذار داشته باشند مشغول بازيهاي رايانه گردند,اينترنت گشت گذار داشته باشند مشغول بازيهاي رايانه گردند
كوچه كوچه هرات كشت گذار كنيد بني,كوچه كوچه هرات گشت گذار كنيد بني
زمان كمتري كشت گذار اينترنت گيرد,زمان كمتري گشت گذار اينترنت گيرد
كشت گذار تقويت موشها ماز موجب يادگيري ميشود,گشت گذار تقويت موشها ماز موجب يادگيري ميشود
جاذبه توريستي فرهنگي برخودار كشت گذار پهنه وسيع دوستان ميهنانم توصيه ام,جاذبه توريستي فرهنگي برخودار گشت گذار پهنه وسيع دوستان ميهنانم توصيه ام
ارديبهشت فصل سفر كشت گذار شكي نيست,ارديبهشت فصل سفر گشت گذار شكي نيست
ايام بهار مردمان شهرستان پاوه روستا حومه كشت گذار استفاده طبيعت زيباي روستا كوهاي اطراف ميايند,ايام بهار مردمان شهرستان پاوه روستا حومه گشت گذار استفاده طبيعت زيباي روستا كوهاي اطراف ميايند
داشتم اينترنت كشت گذار كردم,داشتم اينترنت گشت گذار كردم
طرح موقع كشت گذار خونه ذهنم رسيد,طرح موقع گشت گذار خونه ذهنم رسيد
يكروز كيش كشت گذار گذرانديم,يكروز كيش گشت گذار گذرانديم
كشت گذار بام حميد گفت بام عالمي,گشت گذار بام حميد گفت بام عالمي
جاستين بيبر هنگام كشت گذار پارك افتخار سلنا پدر برادر خواهر معرفي كرد,جاستين بيبر هنگام گشت گذار پارك افتخار سلنا پدر برادر خواهر معرفي كرد
كشت گذار شهر ري كوتاه بالطبع توانم اظهار نظري نمايم,گشت گذار شهر ري كوتاه بالطبع توانم اظهار نظري نمايم
كشت گذار سمت خانه عمه بابا دعوت بوديم رفتيم آذر بابا عباس عمه عمو زن عمو آمده بودند,گشت گذار سمت خانه عمه بابا دعوت بوديم رفتيم آذر بابا عباس عمه عمو زن عمو آمده بودند
راحتي تواند كشت گذار نموده توانمدي داشته ايمان بياورد,راحتي تواند گشت گذار نموده توانمدي داشته ايمان بياورد
قانوني كشت گذار نيرو خارجي قانوني مشوره شوراي ملي تصويب برسانده باشد,قانوني گشت گذار نيرو خارجي قانوني مشوره شوراي ملي تصويب برسانده باشد
داراي 5 سال سابق كاري امور مالي پتروشيمي فارابي رئيس حسابداري شركت رسا رايانه سينا,داراي 5 سال سابقه كاري امور مالي پتروشيمي فارابي رئيس حسابداري شركت رسا رايانه سينا
عضو پايه 1 سازمان نظام مهندسي استان البرز سابق كاري 14سال,عضو پايه 1 سازمان نظام مهندسي استان البرز سابقه كاري 14سال
كسري ثانيه فرم سابق كاري سطل زباله هدايت,كسري ثانيه فرم سابقه كاري سطل زباله هدايت
اولين نامه سابق كاري گرفتم عبارت توش نوشتم,اولين نامه سابقه كاري گرفتم عبارت توش نوشتم
طرفي سابق كاري مانع هيئت علمي شه,طرفي سابقه كاري مانع هيئت علمي شه
ارائه رزومه سابق كاري الزامي بوده عدم ارائه موجب رد پيشنهاد ميگرد,ارائه رزومه سابقه كاري الزامي بوده عدم ارائه موجب رد پيشنهاد ميگرد
داراي سابق كاري مفيد آموزش وترويج ونيزداراي رتبه بندي پروانه اشتغال ازسازمان نظام مهندسي باشند,داراي سابقه كاري مفيد آموزش وترويج ونيزداراي رتبه بندي پروانه اشتغال ازسازمان نظام مهندسي باشند
حادثه تصادف شخصي يه مجرم سابق دار بوده كشته ميشه,حادثه تصادف شخصي يه مجرم سابقه دار بوده كشته ميشه
قوه خشم غصب مديريت مهار نشود,قوه خشم غضب مديريت مهار نشود
خشم غصب پروردگار ميترسيد قرائت قرآن كريم دست برنداشت,خشم غضب پروردگار ميترسيد قرائت قرآن كريم دست برنداشت
پنجهزار سال قبل خداي آب فرط خشم غصب دل آسمان آب زيادي زيادي ريخت زمين بلعيده,پنجهزار سال قبل خداي آب فرط خشم غضب دل آسمان آب زيادي زيادي ريخت زمين بلعيده
صدقه شب خشم غصب خداوند خاموش گناه بزرگ محو,صدقه شب خشم غضب خداوند خاموش گناه بزرگ محو
فرهنگ اسلام عفو بخش رحمت خشم غصب انتقام خصوصا نسبت مؤمنين نزديكان ترجيح داده گفته,فرهنگ اسلام عفو بخش رحمت خشم غضب انتقام خصوصا نسبت مؤمنين نزديكان ترجيح داده گفته
براحتي ميتوان خشم غصب چهره فرد مقابل ديد,براحتي ميتوان خشم غضب چهره فرد مقابل ديد
منتظر حقيقي داند امام عصر عج مظهر عدالت خشنودي خدا رسول خشم غضب موحب خشم غصب خداوند پيامبر باشد,منتظر حقيقي داند امام عصر عج مظهر عدالت خشنودي خدا رسول خشم غضب موحب خشم غضب خداوند پيامبر باشد
فشار خونت ميرود خشم غصب غالب ميگرد مقابله برميخيزي,فشار خونت ميرود خشم غضب غالب ميگرد مقابله برميخيزي
كودك آموخت احساس خشم غصب طبيعى ولى نبايد تسليم كنترل بدرفتارى خودارى كرد,كودك آموخت احساس خشم غضب طبيعى ولى نبايد تسليم كنترل بدرفتارى خودارى كرد
اشاره هزار تن صادرات محصولات كشاورزي سالجاري استان كرمانشاه كشور عرق افزود,اشاره هزار تن صادرات محصولات كشاورزي سالجاري استان كرمانشاه كشور عراق افزود
محصولات شيشه دست ساز استان وزن 125 هزار 360 ارزش ريالي 10 ميليارد 52 ميليون 917 هزار 60 ارزش دلاري 860 هزار 760 كشور عرق صادر,محصولات شيشه دست ساز استان وزن 125 هزار 360 ارزش ريالي 10 ميليارد 52 ميليون 917 هزار 60 ارزش دلاري 860 هزار 760 كشور عراق صادر
كشور عرق 14 سال ريزگردها مواجه,كشور عراق 14 سال ريزگردها مواجه
محكوميت عدم پخش شبكه ماهواره ايراني سوي رسانه كشور عرق نمونه همدلي,محكوميت عدم پخش شبكه ماهواره ايراني سوي رسانه كشور عراق نمونه همدلي
فقها تعريف نگاه كبيره نظر يكسان ندارند,فقها تعريف گناه كبيره نظر يكسان ندارند
مگه ميشه يه سفر افطار نشست زوليبا باميه نباشه,مگه ميشه يه سفره افطار نشست زوليبا باميه نباشه
هفته اينده اداره سفر افطار ميزبان روساي هيات ورزشي,هفته اينده اداره سفره افطار ميزبان روساي هيات ورزشي
سفر افطار نشسته بوديم خونواده شور اشتياقي داشت,سفره افطار نشسته بوديم خونواده شور اشتياقي داشت
خوشبختي شاد كردن دل دوستات پاي سفر افطار,خوشبختي شاد كردن دل دوستات پاي سفره افطار
شله آش بژي برساق كلهكنجي شلهزرد حليم آش گندم شيره خرما تهيه ميكند سفر افطار ميگذارند,شله آش بژي برساق كلهكنجي شلهزرد حليم آش گندم شيره خرما تهيه ميكند سفره افطار ميگذارند
ماه محرم ماه رمضان هيات دوستانش شركت پاي سفر افطار نشيند,ماه محرم ماه رمضان هيات دوستانش شركت پاي سفره افطار نشيند
همونجا ديدم داره سفر افطار ميچينه,همونجا ديدم داره سفره افطار ميچينه
ادامه مراسم مسابقه قرآني قرعهكشي برگزار سفر افطار گسترده,ادامه مراسم مسابقه قرآني قرعهكشي برگزار سفره افطار گسترده
ادامه اشاره سنگ ناحيه حالب پوليپ مجازي ادرار عل سوزش ادراري,ادامه اشاره سنگ ناحيه حالب پوليپ مجاري ادرار عل سوزش ادراري
مداواي مجازي ادرار دستگاه تنفسي كاتاره معده روده عنوان كمك درماني مداواي ديابت استفاده,مداواي مجاري ادرار دستگاه تنفسي كاتاره معده روده عنوان كمك درماني مداواي ديابت استفاده
نار ادرار آور آب انار بيماريهاي مجازي ادرار مفيد,نار ادرار آور آب انار بيماريهاي مجاري ادرار مفيد
دكتر سيمين وحيدي متخص مجازي ادراري گفتگو خبرنگار كلينيك باشگاه خبرنگاران اشاره ايرانيان بالاترين آمار مبتلايان سنگ منطقه دارا گفت,دكتر سيمين وحيدي متخص مجاري ادراري گفتگو خبرنگار كلينيك باشگاه خبرنگاران اشاره ايرانيان بالاترين آمار مبتلايان سنگ منطقه دارا گفت
دوستي مجاري متفاوت دوستي حضوري ايجاد وابستگي 8سال 1دختر,دوستي مجازي متفاوت دوستي حضوري ايجاد وابستگي 8سال 1دختر
دانشگاه مجاري پارس اولين دانشگاه مجازي فارسي زبان دنياست خودشو عنوان دروازه ورود جامعه مجازي معرفي,دانشگاه مجاري پارس اولين دانشگاه مجازي فارسي زبان دنياست خودشو عنوان دروازه ورود جامعه مجازي معرفي
شرايطي دانشگاه مجاري قطب فناوري اسلام ناب جهان معاصر تبديل,شرايطي دانشگاه مجازي قطب فناوري اسلام ناب جهان معاصر تبديل
دانشگاهاي مجاري شركت دانشجوي دانشگاها شوم,دانشگاهاي مجازي شركت دانشجوي دانشگاها شوم
دانشجوي دانشگاه مجاري هستم,دانشجوي دانشگاه مجازي هستم
اول خانم مدارس دانشگاه مجاري خانه باشند,اول خانم مدارس دانشگاه مجازي خانه باشند
طبق اعلام مسول غرفه دانشگاه مجاري علوم حديث شيوه نوين كارآمد گسترش آموزش ايجاد امكان فراگيري زمان مكان بهره گيري امكانات مزاياي شبكه اينترنت آموزش الكترونيكي,طبق اعلام مسول غرفه دانشگاه مجازي علوم حديث شيوه نوين كارآمد گسترش آموزش ايجاد امكان فراگيري زمان مكان بهره گيري امكانات مزاياي شبكه اينترنت آموزش الكترونيكي
ميخواستم بدونم شهريه دانشگاه زاد بيشتره دانشگاه مجاري,ميخواستم بدونم شهريه دانشگاه زاد بيشتره دانشگاه مجازي
تور جنگل فيلسواري پل معلق هيجانانگيز هزاران چيز درشت جنگل گسترده يافت,تور جنگل فيلسواري پل معلق هيجانانگيز هزاران چيز ريز درشت جنگل گسترده يافت
