cleaned_wrong_sentence,cleaned_true_sentence
عدل اعتقاد دارين شوال جواب,عدل اعتقاد دارين سوال جواب
اداره حقوقي قوه قضايه نظريه مشورتي پاسخ شوال غيركارمند دولت انجام امري مراجع دولتي وجهي دريافت نمايد,اداره حقوقي قوه قضايه نظريه مشورتي پاسخ سوال غيركارمند دولت انجام امري مراجع دولتي وجهي دريافت نمايد
نامجو پاسخ شوال پيشنهاداتي درخصوص نحوه اجراي فاز دوم هدفمندي اجراي هدفمندي يارانه سازمان هدفمندي داشته ايد,نامجو پاسخ سوال پيشنهاداتي درخصوص نحوه اجراي فاز دوم هدفمندي اجراي هدفمندي يارانه سازمان هدفمندي داشته ايد
يوسفي پاسخ شوال انتخابات دور دوم كمشيده ميشود گفت,يوسفي پاسخ سوال انتخابات دور دوم كمشيده ميشود گفت
بچه كسي نيست شوال مارو جواب بده,بچه كسي نيست سوال مارو جواب بده
شوال واستون بياد عكسها ريخته,سوال واستون بياد عكسها ريخته
راستش متن خوندم ذهنم متبادر گفت ترسيدم كار كردم ميشه انگيزه عمل جواب شوال عشق تقويت كرد,راستش متن خوندم ذهنم متبادر گفت ترسيدم كار كردم ميشه انگيزه عمل جواب سوال عشق تقويت كرد
شوال موقع ازدواج پرسيد گذشته كسي بودي,سوال موقع ازدواج پرسيد گذشته كسي بودي
شوال ذهن ايجاد نكته جاست,سوال ذهن ايجاد نكته جاست
نميدونم شوال مطرح,نميدونم سوال مطرح
گفتم بپرسم شوال بقيه هست بخش بين,گفتم بپرسم سوال بقيه هست بخش بين
جواب شوال نشانه,جواب سوال نشانه
افزايش رسته تحصيلي مركز علمي كاربردي بهزيستي خراسان شمالي,افزايش تحصيلي مركز علمي كاربردي بهزيستي خراسان شمالي
رسته تحصيلي مقطع تحصيلي,تحصيلي مقطع تحصيلي
عمومي رسته تجربي رياضي سوالاتش كنكور مياد,عمومي تجربي رياضي سوالاتش كنكور مياد
مهرانه متولد 29 مهرماه 1373 سوم دبيرستان تموم كردم رسته تجربي,مهرانه متولد 29 مهرماه 1373 سوم دبيرستان تموم كردم تجربي
نيست رسته تجربي حفظي ميگويند ورياضي رارشته عقليون ميگويند خداوند رياضيدان بزرگ,نيست تجربي حفظي ميگويند ورياضي رارشته عقليون ميگويند خداوند رياضيدان بزرگ
رتبه1736 رسته تجربي مجاز ام دوست دارم پرستاري ماماي هوشبري تحصيلات پرستاري ختم شركت,رتبه1736 تجربي مجاز ام دوست دارم پرستاري ماماي هوشبري تحصيلات پرستاري ختم شركت
اول متوسطه رسته تجربي دبيرستان علامه خلخال سال دبيرستان شهيد چمران هشتجين گذراندم,اول متوسطه تجربي دبيرستان علامه خلخال سال دبيرستان شهيد چمران هشتجين گذراندم
سال دوم دبيرستان رسته تجربي,سال دوم دبيرستان تجربي
رسته تجربي پايگاه اجتماعي دارند,تجربي پايگاه اجتماعي دارند
سال چهارم دبيرستان رسته تجربي هستم چطورمي توانم كامپيوتربخوانم بايدتغيرشته بدهم,سال چهارم دبيرستان تجربي هستم چطورمي توانم كامپيوتربخوانم بايدتغيرشته بدهم
وسايل اشپزخانه قابلمه كادر چنگال قاشق ليوان اينجور چيزا,وسايل اشپزخانه قابلمه كارد چنگال قاشق ليوان اينجور چيزا
خدا نصيب صدام تاريخ نكند انهاي كادر چنگال خدا ايند تيغ شيطان ير برند,خدا نصيب صدام تاريخ نكند انهاي كارد چنگال خدا ايند تيغ شيطان ير برند
انواع لوازم خانگي آشپزخانه سرويس آشپزخانه قبيل يخچال يخچال فريزر يخچالهاي ويتريني كادر چنگال خدمات پخش خريد فروش صادرات واردات طبقات 8 1 35 39 نمودهاست,انواع لوازم خانگي آشپزخانه سرويس آشپزخانه قبيل يخچال يخچال فريزر يخچالهاي ويتريني كارد چنگال خدمات پخش خريد فروش صادرات واردات طبقات 8 1 35 39 نمودهاست
مايكروسافت كادر تيز برنده نيمه تبلت كاربران كامپيوترهاي شخصي تقسيم,مايكروسافت كارد تيز برنده نيمه تبلت كاربران كامپيوترهاي شخصي تقسيم
10 ميوه كيان وعده صبح شام,10 ميوه وعده صبح شام
پرهيز كژي كاستي كيان پژوهش,پرهيز كژي كاستي پژوهش
طاهر باطن دين مفهوم كفر تاويل متون ديني مباحثي ارائه,ظاهر باطن دين مفهوم كفر تاويل متون ديني مباحثي ارائه
قرار گرفتن مقام تسليم مقامي پاكي طهارت طاهر باطن نماند,قرار گرفتن مقام تسليم مقامي پاكي طهارت ظاهر باطن نماند
معضلات گفته كار كسب دست فروشان طاهر باطن متفاوت باشد,معضلات گفته كار كسب دست فروشان ظاهر باطن متفاوت باشد
موصوف علم تاويل تفاوت طاهر باطن افراد جديدالمذهب تعليم داد,موصوف علم تاويل تفاوت ظاهر باطن افراد جديدالمذهب تعليم داد
مرهون پاكدامنى عفت طاهر باطن پاسدارى رمز پايدارى حجاب,مرهون پاكدامنى عفت ظاهر باطن پاسدارى رمز پايدارى حجاب
امام زمان عج جانب خدا قدرت دارند طاهر باطن افراد علم پيدا,امام زمان عج جانب خدا قدرت دارند ظاهر باطن افراد علم پيدا
جامه فرش نجس باران بارد جاى برسد طاهر باطن پاك مىشود,جامه فرش نجس باران بارد جاى برسد ظاهر باطن پاك مىشود
مرهون پاكدامنى عفت طاهر باطن پاسدارى رمز پايدارى حجاب,مرهون پاكدامنى عفت ظاهر باطن پاسدارى رمز پايدارى حجاب
بهترين كارايو داره موقع خراب نميشه ميگم طاهر ويندوز اهميتي نداره محم كاراي ويندوز هست,بهترين كارايو داره موقع خراب نميشه ميگم ظاهر ويندوز اهميتي نداره محم كاراي ويندوز هست
درضمن كسي سوالم تغير طاهر ويندوز پرسيدم بهم جواب بده منون ميشم,درضمن كسي سوالم تغير ظاهر ويندوز پرسيدم بهم جواب بده منون ميشم
طاهر آراسته ميسوزد دل,ظاهر آراسته ميسوزد دل
بيني طاهر آراسته شگفت,بيني ظاهر آراسته شگفت
مهارت دوست يابي شامل طاهر آراسته شستن دست صورت مسواك زدن پوشيدن لباس پاكيزه لبخند زدن اظهار محبت ايجاد دوستي قدم دوستي رعايت نوبت سخن گفتن دعوت كردن,مهارت دوست يابي شامل ظاهر آراسته شستن دست صورت مسواك زدن پوشيدن لباس پاكيزه لبخند زدن اظهار محبت ايجاد دوستي قدم دوستي رعايت نوبت سخن گفتن دعوت كردن
طاهر تميز ومرتب بوي عطر وتميزي ارامش مياره كسي ازحموم طول روزبايد عطر ادكلن استفاده بكنه,ظاهر تميز ومرتب بوي عطر وتميزي ارامش مياره كسي ازحموم طول روزبايد عطر ادكلن استفاده بكنه
تغيراتي طاهر ايجاد,تغيراتي ظاهر ايجاد
داري طاهر ميپيني ظاهر ميكني,داري ظاهر ميبيني ظاهر ميكني
طاهر اهميت نميدم,ظاهر اهميت نميدم
پيشنهاد گشاده بابا ظاهر عريان فرمانده نيروى انتظامى سرداراحمدى مقدم,پيشنهاد گشاده بابا طاهر عريان فرمانده نيروى انتظامى سرداراحمدى مقدم
بيتي بابا ظاهر,بيتي بابا طاهر
امضا بابا ظاهر عريان,امضا بابا طاهر عريان
آخرين نفر بتمن صورت شخصيتهاي شبيه بابا ظاهر شدهاست,آخرين نفر بتمن صورت شخصيتهاي شبيه بابا طاهر شدهاست
زيبا كارد بندي,زيبا كادر بندي
منظورم هست نميدونم كارد بندي مياد,منظورم هست نميدونم كادر بندي مياد
رنگ نور هارموني رنگ قهوه آبي آسماني كارد بندي مناسب,رنگ نور هارموني رنگ قهوه آبي آسماني كادر بندي مناسب
سعي كتاب كارد بندي پرتره آرشيوم پيدا بذارم,سعي كتاب كادر بندي پرتره آرشيوم پيدا بذارم
استفاده آموزش ميتوانيد امضاي كاربران بصورت منظم كارد بندي نمايش دربياوريد,استفاده آموزش ميتوانيد امضاي كاربران بصورت منظم كادر بندي نمايش دربياوريد
برسي موضوع شفاعت قرآن توجه آيات 47و48سوره بقره,برسي موضوع شفاعت قرآن توجه آيات 47و48سوره بقره
برسي تخصي مبحث تست كامل انجام ميدن,برسي تخصي مبحث تست كامل انجام ميدن
معرفي برسي تخصي ويندوز 8,معرفي برسي تخصي ويندوز 8
برسي تخصي استايل بسكتباليستها هنگام پرتاب,برسي تخصي استايل بسكتباليستها هنگام پرتاب
نقد برسي تخصي اسمارت فون آندرويدي قدرتمند نام,نقد برسي تخصي اسمارت فون آندرويدي قدرتمند نام
برسي انواع شوت مهارت بسكتبال,برسي انواع شوت مهارت بسكتبال
برسي تخصي كامپيوتر روميزي فوق پيشرفته اپل نام,برسي تخصي كامپيوتر روميزي فوق پيشرفته اپل نام
برسي تخصي تبلت جديد سامسونگ نام,برسي تخصي تبلت جديد سامسونگ نام
معرفي برسي تخصي ايپد نسل چهارم,معرفي برسي تخصي ايپد نسل چهارم
زندگي فداي كشور نقد برسي مبارزه خليج عدن,زندگي فداي كشور نقد برسي مبارزه خليج عدن
نقد برسي كتاب خواب خِرد مؤسه تحصيلات عالي ابن سينا,نقد برسي كتاب خواب خِرد مؤسه تحصيلات عالي ابن سينا
دستاوردهاي صنعت برق كشور چهره خارجي ايران سفر مسئولين توان پرسيد برسي كرد موفقيت صنعت برق نشان دهنده توان نيروي متخص ارزش مدار برنامهريزي دقيق صنعت,دستاوردهاي صنعت برق كشور چهره خارجي ايران سفر مسئولين توان پرسيد برسي كرد موفقيت صنعت برق نشان دهنده توان نيروي متخص ارزش مدار برنامهريزي دقيق صنعت
مقالات بعدي اختصاصي دوره برسي خواهيم كرد,مقالات بعدي اختصاصي دوره برسي خواهيم كرد
حجةالاسلام حبيب صداقت پور نماينده گروه بصيرت گفت قمه زني توان منظر برسي كرد,حجةالاسلام حبيب صداقت پور نماينده گروه بصيرت گفت قمه زني توان منظر برسي كرد
اومعتقد بحران افغانستان نقش پاكستان كشور برسي كرد,اومعتقد بحران افغانستان نقش پاكستان كشور برسي كرد
سوالها تخصي آنهارا برسي كرد وجوابي مسئولين امور گرفت,سوالها تخصي آنهارا برسي كرد وجوابي مسئولين امور گرفت
اوقات شرلوك برسي سرنخ خانه آورده اسيد آب تيغه برسي كنيد,اوقات شرلوك برسي سرنخ خانه آورده اسيد آب تيغه برسي كنيد
جميز چهارم برسي كرد درسال 150 ميلادي بچه آزمايش قرار داد زبان عبري صحبت نمودند,جميز چهارم برسي كرد درسال 150 ميلادي بچه آزمايش قرار داد زبان عبري صحبت نمودند
فرعون مصر 60 سال قبل ميلاد موضوع برسي كرد,فرعون مصر 60 سال قبل ميلاد موضوع برسي كرد
واقعيت تلخي هستش اونو كامل برسي كرد,واقعيت تلخي هستش اونو كامل برسي كرد
يونيزاسيون اب توان ثابت تعادل شرح داد چگونگي تبديل مايع يون برسي كرد,يونيزاسيون اب توان ثابت تعادل شرح داد چگونگي تبديل مايع يون برسي كرد
مشكل برق رساني شهرك شهرستان خرم بيد برسي,مشكل برق رساني شهرك شهرستان خرم بيد برسي
مشكلات مسكن مهر اشتهارد برسي,مشكلات مسكن مهر اشتهارد برسي
فيلم سنگسار ثريا دانشگاه شيراز نقد برسي,فيلم سنگسار ثريا دانشگاه شيراز نقد برسي
مسائل ايثارگران برسي,مسائل ايثارگران برسي
برسي موضوع شفاعت قرآن توجه آيات 47و48سوره بقره,برسي موضوع شفاعت قرآن توجه آيات 47و48سوره بقره
تغيرات پوش گياهي سرشاخه كارون برسي,تغيرات پوش گياهي سرشاخه كارون برسي
فيلمهاي اول جشنواره نقد برسي,فيلمهاي اول جشنواره نقد برسي
راهكارهاي ارائه تسهيلات ارزي توليد صنعت كشاورزي برسي,راهكارهاي ارائه تسهيلات ارزي توليد صنعت كشاورزي برسي
اونجا كردي پردي غذا ماكارني خوردي كبك تولد خوردي,اونجا كردي پردي غذا ماكارني خوردي كيك تولد خوردي
گرم قالب كبك يزدي چرب آماده كنين,گرم قالب كيك يزدي چرب آماده كنين
خواب ديدم بچه اومديم خونتون تولدت آزاده واست كبك تولد خريده,خواب ديدم بچه اومديم خونتون تولدت آزاده واست كيك تولد خريده
نامرد انتخابات دور دهم رياست جمهوري حضور اقليتهاي اصفهان ديدار پيشواي ارامنه جنوب كشور گفت,نامزد انتخابات دور دهم رياست جمهوري حضور اقليتهاي اصفهان ديدار پيشواي ارامنه جنوب كشور گفت
نامرد انتخابات رياست جمهوري 8 دانشجويان دانشگاه اروميه حاضر,نامزد انتخابات رياست جمهوري 8 دانشجويان دانشگاه اروميه حاضر
ريس ستاد انتخابات استان بوشهر اعلام صلاحيت 6 نامرد انتخابات مجلس استان شوراي نگهبان اعلام گفت,ريس ستاد انتخابات استان بوشهر اعلام صلاحيت 6 نامزد انتخابات مجلس استان شوراي نگهبان اعلام گفت
ناطقنوري نامرد انتخابات رياست جمهوري نميشود,ناطقنوري نامزد انتخابات رياست جمهوري نميشود
جناب دكتر محمد جواد لاريجاني آمل نامرد مجلس شدند راي نياورد,جناب دكتر محمد جواد لاريجاني آمل نامزد مجلس شدند راي نياورد
گزارش رسيده 2 نامرد مجلس شوراي مشهد تخريب,گزارش رسيده 2 نامزد مجلس شوراي مشهد تخريب
تكرار فاجعه زماني 130 نماينده نامرد مجلس رهبري نامه نوشتند,تكرار فاجعه زماني 130 نماينده نامزد مجلس رهبري نامه نوشتند
قانون داشت نامرد مجلس ميتوانستند مجلس مريضي گرفتاري بيندازند,قانون داشت نامزد مجلس ميتوانستند مجلس مريضي گرفتاري بيندازند
نامرد بهترين فيلم اسكار جداي نادر سيمين,نامزد بهترين فيلم اسكار جداي نادر سيمين
نامرد بهترين بازيكن زن سال مسئله اتفاق نظر دارند,نامزد بهترين بازيكن زن سال مسئله اتفاق نظر دارند
سال 207 نامرد بهترين سال,سال 207 نامزد بهترين سال
يازي نامرد بهترين سال,يازي نامزد بهترين سال
مدودف تاكيد كرد مايل صورتي نامرد انتخابات آينده,مدودف تاكيد كرد مايل صورتي نامزد انتخابات آينده
حلقه نامردي,حلقه نامزدي
حلقه نامردي همش داره تكرار ميشه,حلقه نامزدي همش داره تكرار ميشه
دختره حلقه نامردي داره پسره نداره,دختره حلقه نامزدي داره پسره نداره
شوهرم برام حلقه نامرديكيك موزيك پول ارايشگاه داد,شوهرم برام حلقه نامزديكيك موزيك پول ارايشگاه داد
دوراني خاتمي كانديدا نگاه كنيد پاسخهاي بردار مبارز محسن آرمين,دوراني خاتمي كانديدا نگاه كنيد پاسخهاي برادر مبارز محسن آرمين
بردار بسيجي حسين اماني,برادر بسيجي حسين اماني
بگيم بردار بسيجي احترامي دونستن اقاي حاج امير حسيني ميگين خواهر بسيجي,بگيم برادر بسيجي احترامي دونستن اقاي حاج امير حسيني ميگين خواهر بسيجي
بردار بسيجي درقلب برگرد دامان ملت مامور انتظامي محافظ هستي,برادر بسيجي درقلب برگرد دامان ملت مامور انتظامي محافظ هستي
ولايتي نسخه ساخته بردار بسيجي ده نمكي,ولايتي نسخه ساخته برادر بسيجي ده نمكي
امدادگران بسيجي هشت سال دفاع مقدس استان يزد تقدير بردار بسيجي جبران نمايند,امدادگران بسيجي هشت سال دفاع مقدس استان يزد تقدير برادر بسيجي جبران نمايند
مصاحبه اختصاصي بردار بسيجي هكر,مصاحبه اختصاصي برادر بسيجي هكر
صفا الجميلي وزنه برادر عراقي برداشتن وزنه نظر شكست خورد زمين سقوط كرد,صفا الجميلي وزنه بردار عراقي برداشتن وزنه نظر شكست خورد زمين سقوط كرد
ياسر دادوند وزنه برادر جوان كشورمان حركت يكضرب وزنه 165 كيلوگرم ثبت كرد,ياسر دادوند وزنه بردار جوان كشورمان حركت يكضرب وزنه 165 كيلوگرم ثبت كرد
توجه تمرينات مداوم داشته ورود تعداد وزنه برادر گروه سني نوجوانان جوانان انتظار موفقيت چشمگيري نسيب وزنه برداران كرجي,توجه تمرينات مداوم داشته ورود تعداد وزنه بردار گروه سني نوجوانان جوانان انتظار موفقيت چشمگيري نسيب وزنه برداران كرجي
توجه پينگ وزنه برادر مسابقات سال گذشته,توجه پينگ وزنه بردار مسابقات سال گذشته
عنوان بهترين وزنه برادر جهان كسب,عنوان بهترين وزنه بردار جهان كسب
وزنه برادر تيم مناطق نفت خيز جنوب گفت,وزنه بردار تيم مناطق نفت خيز جنوب گفت
سؤال ميماند كسي بگويد وزنه برادر توان بيشتري,سؤال ميماند كسي بگويد وزنه بردار توان بيشتري
نبايد ياد برد متخصان خلاقيت آموختني مختص كره مزين,نبايد ياد برد متخصان خلاقيت آموختني مختص كره زمين
آمار سمي معتادان كشور ميليون 20 هزار معتاد,آمار رسمي معتادان كشور ميليون 20 هزار معتاد
بنا آمار سمي منتشر يونان تداوم بحران اقتصادي كشور خودكشي,بنا آمار رسمي منتشر يونان تداوم بحران اقتصادي كشور خودكشي
اساس آمار سمي سال 8 بيش 2 ميليون نفر مرزهاي كشور وارد ايران شدند,اساس آمار رسمي سال 8 بيش 2 ميليون نفر مرزهاي كشور وارد ايران شدند
صليب سرخ آمار سمي ميدهد,صليب سرخ آمار رسمي ميدهد
نامه سمي چاپلين پسرش,نامه رسمي چاپلين پسرش
آمار سمي اعلام سوي مقامات 2 كشور حجم مبادلات تجاري تهران عشقآباد 3 ميليارد 20 ميليون دلار سال 209 چهار ميليارد دلار سال 2010 رسيد,آمار رسمي اعلام سوي مقامات 2 كشور حجم مبادلات تجاري تهران عشقآباد 3 ميليارد 20 ميليون دلار سال 209 چهار ميليارد دلار سال 2010 رسيد
آمار سمي نديدم,آمار رسمي نديدم
آمار سمي بانك مركزي 29 درصد,آمار رسمي بانك مركزي 29 درصد
آمار سمي نيست مكن صحيح باشد,آمار رسمي نيست مكن صحيح باشد
دختري سم سال ليلا,دختري سم سال ليلا
سم سال آپيا حساس نحوه تمريناتش خوش نيامده,سم سال آپيا حساس نحوه تمريناتش خوش نيامده
اقا محمد سم سال آقاي هاشمي دنبال قدرت نيس انقلاب كشورش براش مهمه,اقا محمد سم سال آقاي هاشمي دنبال قدرت نيس انقلاب كشورش براش مهمه
سن زداي 25 هزار هكتار گندم زارهاي آذربايجان شرقي,سم زداي 25 هزار هكتار گندم زارهاي آذربايجان شرقي
185 هكتار گندم زارهاي جاجرم سن زداي,185 هكتار گندم زارهاي جاجرم سم زداي
سن زداي 9 هزار 725 هكتار گندم زارهاي آذربايجان شرقي,سم زداي 9 هزار 725 هكتار گندم زارهاي آذربايجان شرقي
سن زداي گندم زارهاي شهرستان ميانه,سم زداي گندم زارهاي شهرستان ميانه
سن زداي مزارع شهرستان فيروزآباد,سم زداي مزارع شهرستان فيروزآباد
رئيس جهادكشاورزي استان البرز طرح سن زداي درنيمي مزارغ گندم استان اجرا,رئيس جهادكشاورزي استان البرز طرح سم زداي درنيمي مزارغ گندم استان اجرا
آغاز سن زداي پيشرفته بيولوژيك گندم كرج,آغاز سم زداي پيشرفته بيولوژيك گندم كرج
630 هكتار مزارع گندم ساوجبلاغ بسيجيان سن زداي,630 هكتار مزارع گندم ساوجبلاغ بسيجيان سم زداي
مبارزه سن هزار هكتار اراضي كشاورزي شهرستان ورامين آغاز,مبارزه سم هزار هكتار اراضي كشاورزي شهرستان ورامين آغاز
مار رسمي ميگويد 2 ميليون معتاد دائمي تفني داريم,آمار رسمي ميگويد 2 ميليون معتاد دائمي تفني داريم
مار رسمي حاكي توليد خودرو شهريورماه سال جاري نسبت شهريورماه سال گذشته درصد توليد خودرو شماه سال جاري نسبت مدت مشابه سال گذشته درصد كاهش يافته,آمار رسمي حاكي توليد خودرو شهريورماه سال جاري نسبت شهريورماه سال گذشته درصد توليد خودرو شماه سال جاري نسبت مدت مشابه سال گذشته درصد كاهش يافته
مار رسمي ليگ باشگاه آسيا,آمار رسمي ليگ باشگاه آسيا
